,title,created_utc,selftext,subreddit,author,media_only,permalink
76,Always wanted to setup my older pieces into various scenes and finally did it when new sideshow figures (top) came in,1596900518,,StarWars,Orestesis,False,/r/StarWars/comments/i60yrf/always_wanted_to_setup_my_older_pieces_into/
77,The Lone Gunslinger...,1596900055,,StarWars,Hobbes8080,False,/r/StarWars/comments/i60u6d/the_lone_gunslinger/
78,"Literally nothing, just mark being a stud.",1596899864,,StarWars,rangersfan7777,False,/r/StarWars/comments/i60sck/literally_nothing_just_mark_being_a_stud/
79,"So I'm getting into the Legends Novels and love em, but have a couple questions",1596899858,"So I started with the Darth Bane trilogy, and finished the first book.  I really enjoy learning about how the Sith came to be and why some members turned to the dark side.  

1. There is a timeline written out inside the book, of all the legends books from Dawn of the Jedi(before the Old Republic) to the Legacy(40+ years after A New Hope).  Is this timeline still accurate? I plan to finish the trilogy, then Plagueis book then start from Dawn of the Jedi and work my way forward in time. 


2.  Are ANY of the legends books canon?  I still will read as many as I can, but was curious to see what they kept(if they kept any ideas).  

3.  I'm a pretty casual SW fan so I've only really seen the 9 movies(need to watch Mandalorian+clone wars tv shows still), but why did they decide to throw out so many books?  I can't imagine all of them being amazing, but still, could they have used some of the ideas or characters from these stories to fill the universe and make it more fleshed out?     Seems like easier way to make money + fans happy.  Take the legends books that people already love, make movie out of it, profit + happy fans? 


4.  I also found this book called ""Splinter of the Minds Eye""  from 1978.  From what I researched, it was written in case the original movie was a flop.  How could writing a book help if people didn't care for the movie?  unless I read something wrong. 

I would be really excited if they ever made a tv show or movie out of the Darth Bane/Plagueis characters.",StarWars,StockpiIeThomas,False,/r/StarWars/comments/i60sae/so_im_getting_into_the_legends_novels_and_love_em/
80,Darth Marú is complete.,1596899851,,StarWars,LivingTaterMan,False,/r/StarWars/comments/i60s82/darth_marú_is_complete/
81,Some fuckin Jurassic park mad scientist *needs* to make these Ewoks.,1596899809,[removed],StarWars,SeamusOS,False,/r/StarWars/comments/i60rug/some_fuckin_jurassic_park_mad_scientist_needs_to/
82,You don't know who James earl Jones is yet you claim to be a star wars fan,1596899311,[removed],StarWars,Florida123love,False,/r/StarWars/comments/i60n2f/you_dont_know_who_james_earl_jones_is_yet_you/
83,"I just watched all the star wars films for the first time recently except for solo and rise of skywalker, Here's my opinion on all of them unfiltered with no nostalgia. (Contains Spoilers but i can't imagine anyone here who hasnt watched all these films)",1596899254,[removed],StarWars,LLotad,False,/r/StarWars/comments/i60mif/i_just_watched_all_the_star_wars_films_for_the/
84,Episode IX is awesome. Anyone who disagrees can go fuck themselves.,1596898638,[removed],StarWars,davywap,False,/r/StarWars/comments/i60ghy/episode_ix_is_awesome_anyone_who_disagrees_can_go/
85,Best Star Wars movie,1596898242,"[removed]

[View Poll](https://www.reddit.com/poll/i60co9)",StarWars,CressLazy,False,/r/StarWars/comments/i60co9/best_star_wars_movie/
86,What was Kenobi burning in the camp fire on Tatooine in Rebels Twin Suns?,1596898186,[removed],StarWars,Emperor-_Palpatine,False,/r/StarWars/comments/i60c63/what_was_kenobi_burning_in_the_camp_fire_on/
87,When we get news about someone getting cast as a character while the show is filming ( aka rosario Dawson as ahsoka) do they start filming later after they get cast or are they already there before filming starts,1596898141,.,StarWars,indianman222,False,/r/StarWars/comments/i60bre/when_we_get_news_about_someone_getting_cast_as_a/
88,"Decided to take some shots with the first two Star Wars figures I ever bought! Sorry for the amateurish editing, I'm always learning. Let's just say Anakin does it again, in a different timeline.",1596897619,,StarWars,ginavore256,False,/r/StarWars/comments/i6070r/decided_to_take_some_shots_with_the_first_two/
89,An old drawing of count dooku,1596897355,,StarWars,ArtsForever,False,/r/StarWars/comments/i604mf/an_old_drawing_of_count_dooku/
90,I hope the Obi Wan Disney+ Show is the most depressing thing we’ll ever see...,1596896746,"So I understand this this show is loooonnnng overdue, as it was always planned to come out 2022 or 2023. Especially with the rumors that it’s in development hell, and then the obvious Covid-19, this show unfortunately will not come out soon but that’s ok as long as they take their time because I am really excited for this show. 



Anyhoo, from reading the title you read right, I want this show to be depressing as it can be but in a beautiful way. For one, this show takes place after Episode 3, to where all hell broke lose. Obi Wan lost everything, and the world just isn’t the same anymore. To top it off, he has to live on a crappy planet that’s always hot and full of sand, to where he has to be hidden all the time. In this show, I want to see Obi Wan at his lowest point in life. Such as Obi Wan constantly having nightmares and waking up from horrifically, trying to catch his breath. Or Obi Wan constantly having memories of the past and just being sad at how all that is gone now.





I guess I want a dystopian vibe of this movie per say, like imagine a beautiful shot of Tatooine at night time, with all the stars and Obi Wan just looking at them reflecting at how he use to travel the galaxy. And then of course he made a friend and is watching over the fire, reflecting the time he burned who was once a brother. God lead that’s so awesome imagining in my head. But yeah... I know people want action and what not which is cool, but I hope this show is just more on the emotional level and just shows us a broken Obi Wan.",StarWars,hushpolocaps69,False,/r/StarWars/comments/i5zz56/i_hope_the_obi_wan_disney_show_is_the_most/
91,Rising from Sand and Scrap ~ DIY bday gift for my son,1596896300,,StarWars,PapaOoomaumau,False,/r/StarWars/comments/i5zv58/rising_from_sand_and_scrap_diy_bday_gift_for_my/
92,Ahsoka the White Digital Illustration by me - @marti_art32,1596895817,,StarWars,MartiBrix,False,/r/StarWars/comments/i5zquf/ahsoka_the_white_digital_illustration_by_me_marti/
93,Heir to the Empire cover I created!,1596895742,,StarWars,conquerlord,False,/r/StarWars/comments/i5zq75/heir_to_the_empire_cover_i_created/
94,"Here’s a pretty fun quiz I found, thought you all would enjoy it",1596895736,,StarWars,bishopj18,False,/r/StarWars/comments/i5zq56/heres_a_pretty_fun_quiz_i_found_thought_you_all/
95,Her giving Chewie his medal made more sense when I remembered she wants to bang him,1596895696,,StarWars,e_gadd,False,/r/StarWars/comments/i5zpr0/her_giving_chewie_his_medal_made_more_sense_when/
96,"One wan’s movie should be a series, like the mandolorian.",1596895565,"I think it would be cool to see it about what happened between revenge of the with and a new hope, and at some point in the series, after a new hope, but only for a little because the afterlife of a force ghost would probably get boring. I think [this](https://youtu.be/3uDwjIBR9s4) is a good example of what they could do.",StarWars,SeamusOS,False,/r/StarWars/comments/i5zolt/one_wans_movie_should_be_a_series_like_the/
97,Luke Skywalker in training by artist Daniel Warren Johnson,1596895542,,StarWars,act1989,False,/r/StarWars/comments/i5zoei/luke_skywalker_in_training_by_artist_daniel/
98,Part of a bridge being built has a really familiar shape...,1596895373,,StarWars,rrralf,False,/r/StarWars/comments/i5zmsv/part_of_a_bridge_being_built_has_a_really/
99,"""What I remember about the rise of the Empire is ... is how quiet it was.""",1596894832,,StarWars,Ace_Larrakin,False,/r/StarWars/comments/i5zhvp/what_i_remember_about_the_rise_of_the_empire_is/
0,"The season 3 rebels finale has some of the best space battle cinematography in the OT style, that I’ve ever seen.",1596893721,It’s taken me awhile to get through rebels but the show has some really really bright spots.,StarWars,Madharder,False,/r/StarWars/comments/i5z81b/the_season_3_rebels_finale_has_some_of_the_best/
1,Help finding a game,1596893659,"I’m looking for an Xbox 360 Star Wars game I played it all the time when I was younger but can’t for the life of me remember what it was called so I can explain it and have some key memories and if someone knows the name that would be great.

You play as key clones like commander fox, Cody and captain Rex I think there where more but those I distinctly remember playing as. It was basically a first person shooter but it wasn’t online I really liked it and the levels were set all over the galaxy s1 level was on a sandy planet which I presume was tatooine but at the time of playing I didn’t know the names of the planets. 
If anyone had any clue to what this game was called i would be so happy but I’ve recently played clone commando or the original battlefront 2 and it wasn’t those 2 I also know it (obviously) wasn’t force unleashed 1/2 or republic heroes.
Again if you know the game thank you so much.",StarWars,JunimoJim,False,/r/StarWars/comments/i5z7h3/help_finding_a_game/
2,"Growing up, I remember this being a thing, then the new sequels come out and it never happened...",1596892165,,StarWars,Cubanrice,False,/r/StarWars/comments/i5yuqv/growing_up_i_remember_this_being_a_thing_then_the/
3,"Punch it, Chewie!",1596891834,,StarWars,Punyae3671,False,/r/StarWars/comments/i5yruo/punch_it_chewie/
4,Just realized the Kamino sabredart in AoTC and the Blade of Ochi in TRoS both had inscriptions that led the protagonists to their destinations,1596891658,,StarWars,e_gadd,False,/r/StarWars/comments/i5yqdj/just_realized_the_kamino_sabredart_in_aotc_and/
5,Ahsoka's Lightsaber?,1596891389,"I want to buy Ahsoka's Lightsaber (from the clone wars). I only need her lightsaber, not her shoto. Most of the time I see it sold out or way to expensive. Can you tell me where I can find one? Thanks",StarWars,Olmota,False,/r/StarWars/comments/i5yo64/ahsokas_lightsaber/
6,Be ready!,1596891318,There are a lot of rumors saying the jedi fallen order 2 trailer is coming out soon. We don’t know if it will be at an online game convention or if it will have it’s separate trailer release on twitter or youtube. Be ready!,StarWars,tc_epic,False,/r/StarWars/comments/i5ynn2/be_ready/
7,The lightsabers,1596890349,,StarWars,MasterTin042,False,/r/StarWars/comments/i5yfyo/the_lightsabers/
8,Question about money in starwars,1596889687,"So i thought, why are they always talking in so low numbers, with so many people ans so many planets you could make a fortune out of a buisness, like ""amazon"" or any other like it. 

Also with companys like Kuat drive yards, which is as i see the biggest company to build ships and any other war instruments. The CEO of it must be the richest guy in the gelaxy, with a NET worth going into the quadrillion. So i dont get why there are so much black market deals and so much crime at all. 

Also it always bothers me why the galactic senat never tried to introduce a viruall currency, it would make black market deals way harder and the police could follow every deal made with ai's.

What are your thoughts on that topic.",StarWars,undeadhulk007,False,/r/StarWars/comments/i5yapk/question_about_money_in_starwars/
9,I created a small discord server for star wars fans,1596889569,,StarWars,CarolDanvers2009,False,/r/StarWars/comments/i5y9ty/i_created_a_small_discord_server_for_star_wars/
10,A line from TLJ that always bothered me,1596889441,"

“Now that they are extinct, the Jedi are romanticized, deified, but if you strip away the myth and look at their deeds, the legacy of the Jedi is failure, hypocrisy, hubris. At the height of their power, they allowed Darth Sidious to rise, create the Empire and wipe them out. It was a Jedi Master who was responsible for the training and creation of Darth Vader.""

Who exactly is romanticising the Jedi? As far as I’m aware, pretty much everyone thought the Jedi were a myth right? I really wish this was something we got to see more, rather then just being told it, that way this lesson might actually have some weight to it. The only way this even makes a little sense, at least from what we see in the ST is from a meta view. Though, it’s still wrong as the Jedi’s legacy isn’t just failure.

And the Jedi didn’t let Sidious rise, they got played by him, hard. Mace would have killed Sidious if Anakin didn’t interfere, I would hardly call that letting him win. The Jedi order definitely had its fault, but they did their best to stand for peace. 

Also, nice job throwing Obi-wan under the bus Luke.",StarWars,Servant-Ruler,False,/r/StarWars/comments/i5y8ue/a_line_from_tlj_that_always_bothered_me/
11,Hello there,1596888345,,StarWars,Tcaf351,False,/r/StarWars/comments/i5y0vl/hello_there/
12,Recently Built A LEGO TIE Fighter.. My Birds Love It!,1596887522,,StarWars,Sunsets_At_Dusk,False,/r/StarWars/comments/i5xv2g/recently_built_a_lego_tie_fighter_my_birds_love_it/
13,Why was there no background lore in the precules?,1596887057,"I'm gonna start out ny saying I'm not a precule hater I thought they were okay. Not as good as the original obviously.

One real problem I have with them was the lack of lore stated in the entire trilogy.

In the original trilogy the background lore was the old republic and mystical jedi. Yoda expands on this in empire explaining to us what the force is. 

In the precules we kinda get nothing... no one every explains go us what the force is like yoda did in empire, no one tells us who the Sith are how the jedi order was formed. 

It would have made for some interesting world building to include old legends of the jedi. The most we get is talk about a prophecy about anakin but..where did this prophecy come from? Who told it? How old is it? It's literally given no explanation at any point. It also changes from bring balance to the force to destroy the sith.

I was playing an old clone wars game and the plot had something to do with an old massive sith weapon that the separatists were trying to use against the republic and I thought oh man how cool would it be if old stories like that were told in the precules.   

It just ended up being very bland with nothing explained to us about these organizations and prophecies.",StarWars,GhostWatcher0889,False,/r/StarWars/comments/i5xrt6/why_was_there_no_background_lore_in_the_precules/
14,What’s yalls favorite book and why?,1596885972,"So I’ve been thinking of getting into some of the books (never read a single one). 
But I was curious as to what was the best book in yalls opinion and any recommendations. Preferably one that has a lot to do with force, sith, and Jedi. I’m looking for something with some badass action in it. Thank you in advance!",StarWars,TheAmazingAutry,False,/r/StarWars/comments/i5xklb/whats_yalls_favorite_book_and_why/
15,"I have a big Disneyland merchandise collection that I would like to sell, any ideas on where is the best place?",1596885624,"Apologize if I’m breaking any rule here. 
So I have this big collection, all from Disneyland and all is still in packaging. I would like to sell all of it but don’t want to start dealing with eBay. Any ideas will be appreciated.",StarWars,tal_o,False,/r/StarWars/comments/i5xi8o/i_have_a_big_disneyland_merchandise_collection/
16,In other words: Have a great day,1596885577,,StarWars,FutureMilitaryWorld,False,/r/StarWars/comments/i5xhye/in_other_words_have_a_great_day/
17,I have a right to say clanker,1596884099,"Those useless droids MURDERED 99 in cold blood. Don’t you dare talk to me about how “it’s their programming” they have sentience. 99 was physically mutated and extremely disabled but still put in 100% effort at all time to help his fellow brothers. What do those stupid, good for nothing clankers do? They kill him with no hesitation. This is why I have a right to say clanker. They don’t deserve to be respected. 

Tl;dr clankers killed 99 so I have a right to disrespect them",StarWars,ProfessorPengu,False,/r/StarWars/comments/i5x8lw/i_have_a_right_to_say_clanker/
18,Some Radom thing I made in a minute or so,1596883334,,StarWars,lucasthistle,False,/r/StarWars/comments/i5x3vv/some_radom_thing_i_made_in_a_minute_or_so/
19,"In the first Rise of Skywalker teaser, you can see that Exegol originally had a red and orange colour scheme in the final battle",1596883284,,StarWars,JamieT0,False,/r/StarWars/comments/i5x3kz/in_the_first_rise_of_skywalker_teaser_you_can_see/
20,"I drew yoda and baby yoda in one piece, what do you think?",1596883140,,StarWars,Azamadness06,False,/r/StarWars/comments/i5x2p8/i_drew_yoda_and_baby_yoda_in_one_piece_what_do/
21,"200,000 units are ready, with a million more well on the way",1596882930,,StarWars,boysetsfire1988,False,/r/StarWars/comments/i5x1e8/200000_units_are_ready_with_a_million_more_well/
22,What did he do again?,1596882704,,StarWars,princeharveyfabian,False,/r/StarWars/comments/i5wzz9/what_did_he_do_again/
23,How Long is the blade of a Shoto,1596882571,"The tile says it all, I was wondering how long the blade of a Shoto is because I want to buy a normal saber with a Shoto.
And Google does not tell how long the blade is...

Thx in advance for an answer.",StarWars,UruzTheTortoise,False,/r/StarWars/comments/i5wz5l/how_long_is_the_blade_of_a_shoto/
24,You've been hit by... you've been struck by....,1596881177,,StarWars,Gazza81H,False,/r/StarWars/comments/i5wqv7/youve_been_hit_by_youve_been_struck_by/
25,How would the Jedi respond to climate change?,1596881115,"I just came up with the question now for some reason but I thought it might be interesting. The Jedi are all about nature / balance so they would probably have something to say about it.

Also do you guys think it would be an interesting story to portray in a future SW story?",StarWars,country-blue,False,/r/StarWars/comments/i5wqhy/how_would_the_jedi_respond_to_climate_change/
26,My custom Mandolorian: The Blue Devil (Inspired by u/Snackromancer's son),1596880163,,StarWars,Mistic-Instinct,False,/r/StarWars/comments/i5wkpt/my_custom_mandolorian_the_blue_devil_inspired_by/
27,"One of, if not the, dumbest moments in all of Star Wars.",1596878939,,StarWars,TT454,False,/r/StarWars/comments/i5wdhh/one_of_if_not_the_dumbest_moments_in_all_of_star/
28,Duel of the Fates (Art by Josh Shaffer),1596878714,,StarWars,KensukeTanabe,False,/r/StarWars/comments/i5wc7d/duel_of_the_fates_art_by_josh_shaffer/
29,Clone Wars?,1596878166,"I want to see the Clone Wars, but should I watch the series or the movies first (I don’t want to get the storyline mixed up)",StarWars,Nevets_Nevets,False,/r/StarWars/comments/i5w8xi/clone_wars/
30,Ewok mcgregor,1596877953,,StarWars,a-the-click-fan69420,False,/r/StarWars/comments/i5w7lr/ewok_mcgregor/
31,Alderaan is the Star Wars galaxy Switzerland,1596876858,,StarWars,nutriagahst,False,/r/StarWars/comments/i5w0o8/alderaan_is_the_star_wars_galaxy_switzerland/
32,Midichlorians go brrr,1596876803,,StarWars,Assassin007120,False,/r/StarWars/comments/i5w0bw/midichlorians_go_brrr/
33,"Harrison Ford and George Lucas, 1982",1596876448,,StarWars,australiughhh,False,/r/StarWars/comments/i5vyac/harrison_ford_and_george_lucas_1982/
34,Imagine how SW would be if there was only the Originals until now,1596875442,What do you think how would SW look like if there was only epi 4 to 6 until today,StarWars,SilentStone04,False,/r/StarWars/comments/i5vs3v/imagine_how_sw_would_be_if_there_was_only_the/
35,"I’M A MANDALORIAN, WEAPONS ARE PART OF MY RELIGION.",1596875396,,StarWars,every_day_craig,False,/r/StarWars/comments/i5vrt3/im_a_mandalorian_weapons_are_part_of_my_religion/
36,Ewok mcgregor,1596875390,,StarWars,a-the-click-fan69420,False,/r/StarWars/comments/i5vrrh/ewok_mcgregor/
37,"You can say whatever you want , but i love anakin's clone wars armor .(also it is not me how drew that )",1596874269,,StarWars,KONOGIRONNNOGIOVANNA,False,/r/StarWars/comments/i5vkrv/you_can_say_whatever_you_want_but_i_love_anakins/
38,How does Darth Maul have his title?,1596874247,I'm pretty sure Darth plaguis was alive while Maul was Palpatines apprentice. Shouldn't that mean he isn't actually a sith and therefore shouldn't have the title of Darth. Similar to Ventress or Oppress.,StarWars,Billy_B_,False,/r/StarWars/comments/i5vkmw/how_does_darth_maul_have_his_title/
39,Anakins lightsaber button color,1596872985,Me and my friend have been talking about this for a while and we can’t seem to find an answer. He wants Anakin’s  lightsaber from rots. We’re trying to make one and can’t figure out what color to paint the buttons on the front and back does anyone know?,StarWars,sharkey1009,False,/r/StarWars/comments/i5vco1/anakins_lightsaber_button_color/
40,Bobba Fett Drawing I Did A While Back,1596872740,,StarWars,IHAVETHIGHGROUND,False,/r/StarWars/comments/i5vb64/bobba_fett_drawing_i_did_a_while_back/
41,Watching order that don't spoil - contains spoilers though,1596872163,"Try to fill in the shoes of someone that has never seen SW franchise... 

Solo : introduction to the Empire, SW Galaxy and Han and Chewie, Lando, millenium falcon
Rogue One : introduction to the force and Vader, Leia, the rebels
A New Hope : introduction to OB1, Luke, R2 C3P0
The phantom menace : introduction to Jedi order, Yoda, young Anakin, future Palp, Maul (already seen in Solo)
Attack of the Clones : introduction to CW animated serie - episodes leading to order 66
ESB : shock reveal Vader - Luke lineage, Emperor appearing, Yoda fallen master training Luke
RoTS : explains fall of Anakin/Rise of Vader + CW serie episodes during/post order 66 + shock reveal Luke has a sister.
Return of the Jedi : Luke Leia Brotherhood revealed, defeat of the Emperor.

The End",StarWars,Guigui_LB,False,/r/StarWars/comments/i5v7bf/watching_order_that_dont_spoil_contains_spoilers/
42,These Star Wars playing cards,1596871809,,StarWars,sickmorty,False,/r/StarWars/comments/i5v4zc/these_star_wars_playing_cards/
43,Toilet in a gaming cafe,1596871010,,StarWars,SFinTX,False,/r/StarWars/comments/i5uzp6/toilet_in_a_gaming_cafe/
44,Looking for a specific LEGO Star Wars cartoon and episode,1596870591,"So, this is pretty vague but I’m looking for a very specific episode of one of the star wars lego cartoons. All I remember is one single joke. For some reason, Luke and Leia are in orbit around a planet (Tatooine?) and Wedge rolls up with some x-wings. Something happens where he asks a question to Red Five, and then the camera cuts over and Grizz Frix is in the next ship answering the question. Luke gets all salty like “no fair, I’M supposed to be Red Five!” I love pilots more than anything else in Star Wars, so I got the joke, and I found it absolutely hilarious.

I know that’s not much to go on, but does anybody know what that’s from? I’d like to find it.",StarWars,Fyrestrike14,False,/r/StarWars/comments/i5uwuv/looking_for_a_specific_lego_star_wars_cartoon_and/
45,Hyperspace Tracking?,1596870355,"A major plot point of episode 8 was the use of Hyperspace tracking, used by the first order to tail the resistance ships. This isn’t thought possible until it is developed by the first order to catch the resistance off-guard, and destroy the last of their ships. My question is: How is Obi Wan able to track Slave-1 through hyperspace, after leaving Kamino during Attack of the Clones? Is this type of tracking different to Hyperspace tracking? Yet it has the same principle and use.",StarWars,CondensedMilk01,False,/r/StarWars/comments/i5uvbv/hyperspace_tracking/
46,Why does he didn't helped? [Spoiler],1596869900,,StarWars,zamrich2000,False,/r/StarWars/comments/i5us8b/why_does_he_didnt_helped_spoiler/
47,My very controversial list,1596869020,,StarWars,Tobicito,False,/r/StarWars/comments/i5um4f/my_very_controversial_list/
48,I’m sure this will get hate and is the most controversial list on this sub but here is my ranking,1596868969,,StarWars,Tobicito,False,/r/StarWars/comments/i5uls5/im_sure_this_will_get_hate_and_is_the_most/
49,If they made a massive open world Star Wars game what era would you want it to be in?,1596868738,"[removed]

[View Poll](https://www.reddit.com/poll/i5uk66)",StarWars,haydude27hd,False,/r/StarWars/comments/i5uk66/if_they_made_a_massive_open_world_star_wars_game/
50,"Spent a few days on embroidering an old tshirt, “Star Wars” in Aurebesh/Galactic Basic!",1596868731,,StarWars,beesonly,False,/r/StarWars/comments/i5uk4z/spent_a_few_days_on_embroidering_an_old_tshirt/
51,Drawn R2D2 I Have,1596868469,,StarWars,IHAVETHIGHGROUND,False,/r/StarWars/comments/i5ui9g/drawn_r2d2_i_have/
52,Star Wars App Countdown,1596867630,There’s currently a countdown in the Star Wars App for 740 days 08 hrs and 39 mins. Anyone know what it’s counting down to?? That’s two years and ten days away so it’s really got me thinking. Could it be the Obi Wan Show?? Or maybe the trailer for Disney’s new High Republic Era? If anyone has any ideas or speculation I’d love to hear it and am open for discussion.,StarWars,DarthRolo,False,/r/StarWars/comments/i5uc9o/star_wars_app_countdown/
