,title,created_utc,selftext,subreddit,author,media_only,permalink
77,Why Jar Jar Binks is actually Darth Plagueis,1597079328,"I think almost everyone knows the theory about Jar Jar originally being the literal ""Phantom Menace"" of the prequel trilogy, but many people believe that this is impossible after the introduction of Darth Plagueis the Wise in Star Wars Canon.

However, that can't be further from the truth. Darth Jar Jar, in fact, IS Darth Plagueis the Wise.

I know what you're saying. ""We've already heard this theory a million times. We get it, you zoomers like the Prequels more than the sequels. Grow up"". Well, actually, fair point. BUT I actually have logical evidence that not many people know about--

In a deleted scene from Revenge of the Sith, Emperor Palpatine thanks Jar Jar Binks for helping him rise to power. Well, chronologically, Darth Plagueis should be dead at this point. Palpatine murdered his master after becoming Chancellor, per the Dao of the sith. HOWEVER, in the Legends continuity, several sith have been known to live on after death using the transfer essence ability, allowing them to possess both living brings and inanimate objects.

Yeah, I know the Sequel fans are already grabbing their pitchforks to denounce the Legends universe. ""It's not canon anymore! Your theory might've been valid before the Disney acquisition, but now anything related to the Extended Universe has been RETCONED. You're correct, the Legends continuity is now, unfortunately, non-canon. HOWEVER, the transfer essence ability is actually 100%, without a doubt canon...

In the Rise of Skywalker, Darth Sidious used this same technique to survive his initial death at the hands of Darth Vader. He transferred his soul into clones of himself periodically, as his strength in the dark side caused each clone to degenerate at an accelerated rate. This means that Palpatine managed to transfer his essence not just ONCE but possibly DOZENS of times. It's also common knowledge that Darth Plagueis was aware of the transfer essence ability and was even capable of using it, but he initially avoided using it.

Therefore, not only is the Darth Jar Jar theory still valid, but it's very likely that Jar Jar Binks is, in fact, Darth Plagueis the wise possessing the body of a Gungan outcast to destroy the Republic from the inside.

Yeah, I know that the Rise of Skywalker might not be the best movie in the world, but if this is the price to pay to make Darth Jar Jar possible, I think it's worth it.

But that's just a theory, a Star Wars theory, aaaaand cut",StarWars,NinjaSnadger360,False,/r/StarWars/comments/i78vj4/why_jar_jar_binks_is_actually_darth_plagueis/
78,The Skywalkers,1597079166,,StarWars,colbs2187,False,/r/StarWars/comments/i78tk2/the_skywalkers/
79,I'm considering writing an AU--but I want to understand Star Wars canon as entirely as possible.,1597079127,[removed],StarWars,PhantomCube4562,False,/r/StarWars/comments/i78t11/im_considering_writing_an_aubut_i_want_to/
80,[OC] I drew the tragedy of Darth Plageius the wise. It is not accurate to the book. It's what I imagined when I first watched the scene.,1597079068,,StarWars,_DarthSyphilis_,False,/r/StarWars/comments/i78scl/oc_i_drew_the_tragedy_of_darth_plageius_the_wise/
81,Today's my birthday and this is what I got myself. Can't wait to put them together.,1597079005,,StarWars,firefairyqueen,False,/r/StarWars/comments/i78rhz/todays_my_birthday_and_this_is_what_i_got_myself/
82,"[OC] I drew the Tragedy of Darth Plageius the wise. Not what happens in the book, but what I imagined when I first saw the scene.",1597078977,,StarWars,_DarthSyphilis_,False,/r/StarWars/comments/i78r5u/oc_i_drew_the_tragedy_of_darth_plageius_the_wise/
83,I just noticed that someone is wearing a Rebel pilot helmet at the end of solo,1597078452,,StarWars,yorgeesmorgeeYT,False,/r/StarWars/comments/i78l3c/i_just_noticed_that_someone_is_wearing_a_rebel/
84,clone wars season 7 with jj abrams logic,1597078368,,StarWars,EmVALORANT,False,/r/StarWars/comments/i78jwp/clone_wars_season_7_with_jj_abrams_logic/
85,I am the senate,1597078342,,StarWars,FascioLittorio,False,/r/StarWars/comments/i78jka/i_am_the_senate/
86,Hey there Redditor or Mod! This is a photoshop that took me some time since I had to photoshop the saber in front of the added Mace head. I hope you like it!,1597078000,,StarWars,WrekOut123,False,/r/StarWars/comments/i78fn7/hey_there_redditor_or_mod_this_is_a_photoshop/
87,Why couldn't the republic afford to lose Kashyyyk?,1597077895,"[removed]

[View Poll](https://www.reddit.com/poll/i78ege)",StarWars,WhycantIfindanick,False,/r/StarWars/comments/i78ege/why_couldnt_the_republic_afford_to_lose_kashyyyk/
88,My Theory about Kit Fisto. He’s alive.,1597077795,"In Timothy Zahn’s, “Heir to the Empire” he explored Jedi cloning themselves. The practice of cloning force sensitives was not 100% accurate, and could lead to other problems. Many fans have noticed the difference if Kit Fisto’s looks between episode 2 and 3, leading me to believe the Kit Fisto that fought chancellor Palpatine was a weakening clone. And the real Kit Fisto, abandoned the force or was soon killed after Order 66.

 I suggest that Kit Fisto was not the only Jedi involved in this cloning experiment. Shaak Ti. The running joke of Shaak Ti dying could have a reason other than creative difference. One of the clones could have broken out, and have later gone off to fight Galen Marek.

The reason for these clones would be to go on possibly fatal missions that would mark the end of the Jedi order, leaving the original Jedi to try and save the order. They new that there was a dark shadow casting over them, causing them to fear the end of the order and begin cloning the most trusted Jedi in the order.",StarWars,Thrawn-fanboy,False,/r/StarWars/comments/i78dak/my_theory_about_kit_fisto_hes_alive/
89,My friend made this and I think it's beautiful,1597077783,,StarWars,mailboi557,False,/r/StarWars/comments/i78d4i/my_friend_made_this_and_i_think_its_beautiful/
90,Surprise Funko Find Today!! Darth Revan is pretty Amazing!!,1597077749,,StarWars,HeadbanginPirate,False,/r/StarWars/comments/i78crr/surprise_funko_find_today_darth_revan_is_pretty/
91,Found these cool photos from maybe around ten years ago that I thought I should share,1597077740,,StarWars,newaccountoldwashack,False,/r/StarWars/comments/i78co8/found_these_cool_photos_from_maybe_around_ten/
92,So... I accidentally created Darth Vader without a head. Here ya go!,1597077726,,StarWars,WrekOut123,False,/r/StarWars/comments/i78cio/so_i_accidentally_created_darth_vader_without_a/
93,Do mandalorians replace their jet pack missles?,1597077423,,StarWars,scattergun25,False,/r/StarWars/comments/i7890t/do_mandalorians_replace_their_jet_pack_missles/
94,When life gives you a rock...,1597077187,,StarWars,rvanniarts,False,/r/StarWars/comments/i78675/when_life_gives_you_a_rock/
95,Let’s go....,1597077045,,StarWars,CapX211,False,/r/StarWars/comments/i784km/lets_go/
96,Fully Automated Luxury Star Wars - The Rise of Skywalker | Renegade Cut,1597076999,,StarWars,DoubleTFan,False,/r/StarWars/comments/i7841t/fully_automated_luxury_star_wars_the_rise_of/
97,When there's a rock in he way...,1597076873,,StarWars,rvanniarts,False,/r/StarWars/comments/i782m3/when_theres_a_rock_in_he_way/
98,"Carrie Fisher and Mark Hamill, 1979",1597076147,,StarWars,australiughhh,False,/r/StarWars/comments/i77ub0/carrie_fisher_and_mark_hamill_1979/
99,I made Vader's TIE Advanced x1...,1597076068,,StarWars,_nightsnotover,False,/r/StarWars/comments/i77tg9/i_made_vaders_tie_advanced_x1/
0,The fiery opening Luke walks through looks a lot like the stained battlefield on the other side,1597075409,,StarWars,ShambolicClown,False,/r/StarWars/comments/i77luq/the_fiery_opening_luke_walks_through_looks_a_lot/
1,"Carrie Fisher and Mark Hamill, 1976",1597075202,,StarWars,australiughhh,False,/r/StarWars/comments/i77je2/carrie_fisher_and_mark_hamill_1976/
2,The fiery opening Luke walks through looks a lot like Crait's battlefield,1597075154,,StarWars,ShambolicClown,False,/r/StarWars/comments/i77iss/the_fiery_opening_luke_walks_through_looks_a_lot/
3,"We all know which trilogy was better, but which trilogy has the best memes, prequel or sequel",1597074823,,StarWars,YourMumsBigToe1,False,/r/StarWars/comments/i77f2q/we_all_know_which_trilogy_was_better_but_which/
4,Spent my weekend assembling and painting this wonderful Bandai model to look like Finn at the start of TFA. I’m really happy with it!,1597074711,,StarWars,groggydog,False,/r/StarWars/comments/i77dua/spent_my_weekend_assembling_and_painting_this/
5,"If you think about it, the balance in the Force was restored not only through Rey being all the Jedi, but by the Dyad as well. Palpatine was defeated by his own power that he stole from the Dyad's life force. The prophecy came true. And that is beautiful.",1597074679,"I may have had my grievances with ROTS but after over half a year since its release and a rewatch, I'm starting to actually... like it. It is somewhat tragic that such brilliant messages, clearly crafted with thought and care, got lost in the chaos of its storytelling.",StarWars,TLJDidNothingWrong,False,/r/StarWars/comments/i77dhw/if_you_think_about_it_the_balance_in_the_force/
6,The fiery opening Luke walks through Luke's a lot like Crait's battlefield,1597074654,,StarWars,ShambolicClown,False,/r/StarWars/comments/i77d6y/the_fiery_opening_luke_walks_through_lukes_a_lot/
7,Does shielding on Alliance fighter craft ever actually play an explicit role in media apart from the games?,1597074620,"I suppose its common knowledge around here that Alliance fighters typically possess shielding, life support, astromechs, hyperdrive, sensor scramblers, air conditioning, power steering, cruise control, anti-theft deterrent, and AM/FM radio. TIE fighters have their own innovations like the solar panels on the wings or the twin ion engines themselves, and they do have specialized models, but the main rock-paper-scissors models (TIE LN/SA/IN) all lack the shielding and life support XYAB-wings have and are flying soda cans in comparison (I apologize to the empire's supporters).

But aside from being a gameplay mechanic in x-wing, rogue squadron, battlefront, ect. Does shieling ever actually play a role in the franchise other than informed ability?

We know the alliance needs to protect the lives of its fewer but skilled pilots ,and survivability as a rebel pilot is much higher compared to Imperials that use swarm tactics to overwhelm opponents. So because TIE pilots are expendable The Empire spends no extra money to protect them. But in the films just about every close up shot we see of the various Alliance pilots are right before they get blown up due to the somewhat triple-burst-like fire of the regular TIEs cannons or the fully-automatic-esque quad lasers of interceptors. - if they show a starfighter on either side in any era get hit, that pilot usually dies. The only discernible difference is that rebel pilots live long enough to scream and crash while most TIEs have been shown to combust.

The only three exceptions i can think of to this rule are all in New Hope where Wedge is hit once and has to leave, Luke is hit i think twice...maybe even three depending on which version of the movie it is, and Vader's Tie Adv is not only crashed into by a wing-mate but I THINK it also ping-pongs off the trench wall and bounces out into space.

So does shielding actually play a role in ship-to-ship combat? Or is this just something to differentiate good/evil? Like is there a book, comic, or any media where shielding explicitly saved a pilot from death? Or the starship took hits and managed to continue fighting? The Millenium Falcon and Mandalorian's Razor Crest are classified as a light frieghter and gunship respectively, and so for this reason, they wont count.",StarWars,PizzamanCJ,False,/r/StarWars/comments/i77cs4/does_shielding_on_alliance_fighter_craft_ever/
8,"Finished another model, this time, another one of my favorite troopers in the Empire, the Shadow Trooper!",1597073767,,StarWars,Boogi29,False,/r/StarWars/comments/i772xl/finished_another_model_this_time_another_one_of/
9,My Grandad loves collecting old bits and bobs and he recently found these stored away in his garage. Would anyone be able to shed any light to wether his find holds any value please ? (To be clear these aren’t mine nor is this a sales advert),1597073604,,StarWars,Jug-vs-Phd,False,/r/StarWars/comments/i7711c/my_grandad_loves_collecting_old_bits_and_bobs_and/
10,Clone Wars is the best Star Wars,1597073513,,StarWars,SN-Pennypacker,False,/r/StarWars/comments/i77017/clone_wars_is_the_best_star_wars/
11,"The name’s Rex, but you can call me Captain or Sir.",1597072806,,StarWars,UsedGamertag,False,/r/StarWars/comments/i76s0j/the_names_rex_but_you_can_call_me_captain_or_sir/
12,Saw the other day someone found their burger king watch and converted it to be used with their apple watch. I just found mine!!! ::looks at my Nike wristband:: “time to abandon ship!”,1597072260,,StarWars,TheOkayBambino,False,/r/StarWars/comments/i76m14/saw_the_other_day_someone_found_their_burger_king/
13,Rebels Season 4 is some of the best Star Wars content I've seen,1597072098,"This show in general had a very tight and thought-out narrative, and this season especially had intricate resolutions to multiple story arcs.  We get fleshed out resolution relating to Kannan/Hera, Sabine and her homeworld, Agent Kallus and his past history with Zeb's race, every space pirate we've met so far, and Ezra's final lesson, to name a few.  I am amazed at how so many story lines were wrapped up and the respect the showrunners gave each one.  This season truly felt like an ending to a story.

&amp;#x200B;

The production value was cranked up for this season.  I always appreciated the cinematic shots of fleets in space in the earlier seasons, and this season took that to another level (I'd almost say Rogue One levels).  If anything, watch the first 5 minutes of episode 9 Rebel Assault.  You get a classic attack of rebel fighters  breaking through a star destroyer blockade.  The ship movements and cinematography are very similar to the space fighting in Rogue One.  It was moments like these that truly felt like Star Wars.  Additionally, there is some spectacular animation sprinkled throughout land combat scenes such as characters diving out of harms way in a quick, fluid motion.  Even these quick little bits gave the show added polish.

&amp;#x200B;

We get an absolutely baddass bounty hunter named Rukh.  In a galaxy filled with pride-centered imperial officers, we finally get a competent adversary that puts his job before himself and is clearly respected by his superiors.  It's refreshing to see an Empire character that's good at his job and and not admonished after a setback.

&amp;#x200B;

**Hard Spoilers Below**

Some common complaints I've seen revolve around Ezra's story and thin lightsabers.  

Ezra's arc revolved around liberating Lothal and finding his parents.  Both are common themes throughout all 4 seasons.  Ezra was always quick to act in the heat of the moment especially if the issue related to something Ezra was emotionally attached to (his lost parents, people on Lothal, friends).  Ezra manages to find a Force gateway that provides the opportunity to change moments in time.  When presented with the chance to save Kannan, Ezra strongly wants to save his mentor but realizes if he does, Kannan's sacrifice would lead to the deaths of all his friends and himself.  Ezra had to let that opportunity go.  Later, the Emperor entices Ezra with an opportunity to be with his family before they disappeared (essentially going back in time).  Ezra wants nothing more than to do so, but he knows this will undo all the Rebels have accomplished.  Again, he lets this opportunity slide.  It is here that Ezra realizes he can't get the past back but he can save the future of his people and friends.  To me, that's a satisfying character arc.  

&amp;#x200B;

As for the thin lightsabers, you have to get over it.  I agree they are too thin and look jarring, but after the first few episodes of the series you get used to them.  And, in Season 4, they do appear a bit thicker.  If you're whole reason for not watching this show is because of the look of a lightsaber, you are not opening yourself up to so much awesome Star Wars content, and that is a petty trade-off.

&amp;#x200B;

If you haven't seen the show and enjoy the original trilogy, I believe this show will impress you.",StarWars,Gnomechild1,False,/r/StarWars/comments/i76k6c/rebels_season_4_is_some_of_the_best_star_wars/
14,Me mad,1597071824,,StarWars,A_botboi_jk,False,/r/StarWars/comments/i76guq/me_mad/
15,I painted the millennium Falcon on a rock last year,1597071472,,StarWars,cashew__man,False,/r/StarWars/comments/i76cpx/i_painted_the_millennium_falcon_on_a_rock_last/
16,Star Wars Figures in Tokyo Yodobashi Akiba,1597071152,,StarWars,iammadeintokyo,False,/r/StarWars/comments/i7697a/star_wars_figures_in_tokyo_yodobashi_akiba/
17,Built a tiny Hangar for Vader’s TIE.,1597071150,,StarWars,boylei,False,/r/StarWars/comments/i7695o/built_a_tiny_hangar_for_vaders_tie/
18,Was cleaning out my closet and found something I thought you guys would enjoy!,1597071081,,StarWars,HonestSoul3,False,/r/StarWars/comments/i768el/was_cleaning_out_my_closet_and_found_something_i/
19,Was cleaning out my closet and found something i thought you guys would enjoy!,1597070994,,StarWars,HonestSoul3,False,/r/StarWars/comments/i767en/was_cleaning_out_my_closet_and_found_something_i/
20,“One Down” - action figure photography by me,1597070994,,StarWars,imprimis5,False,/r/StarWars/comments/i767ed/one_down_action_figure_photography_by_me/
21,Day 1 of turning this old Kayak ore into a LEGO lightsaber. I spray painted the blade red and tommorow I’m going to spray the hilt metallic silver.,1597070854,,StarWars,masterbuilderethan,False,/r/StarWars/comments/i765yx/day_1_of_turning_this_old_kayak_ore_into_a_lego/
22,My Minecraft AT-AT design,1597070542,,StarWars,logan__wilton,False,/r/StarWars/comments/i762k9/my_minecraft_atat_design/
23,"Darth Traya, Betrayer of The Force. || Photoshop By Me",1597070421,,StarWars,Kevin_Science,False,/r/StarWars/comments/i7618i/darth_traya_betrayer_of_the_force_photoshop_by_me/
24,Order 66,1597069649,"I’ve been working on sharing my emotions and actually having emotions lately. And now I’m crying watching them execute Order 66. 

Has this scene always been so sad or have I just been cold hearted? The MUSIC gets me! 

The Music in Star Wars always gets me. It’s the best parts of the new trilogy IMO. Obviously the revival of SW is awesome too thanks to the new saga. But that’s about all it does for me.",StarWars,SistersInsane,False,/r/StarWars/comments/i75st8/order_66/
25,What if,1597069396,What if Padme was the Sith Lord and not Palpatine? How would events turn out?,StarWars,Luthor_798,False,/r/StarWars/comments/i75q7r/what_if/
26,Yoda Oil Painting on Canvas by me,1597069387,,StarWars,spawnofnasty,False,/r/StarWars/comments/i75q2z/yoda_oil_painting_on_canvas_by_me/
27,"Made this with my dad over the weekend, star wars and saxophones are our favorite, hope you enjoy!",1597069364,,StarWars,AdventurousMedicine8,False,/r/StarWars/comments/i75puo/made_this_with_my_dad_over_the_weekend_star_wars/
28,A digital painting of Vader I just finished a little while ago.,1597069219,,StarWars,TheModernIllustrator,False,/r/StarWars/comments/i75ocn/a_digital_painting_of_vader_i_just_finished_a/
29,"First 8 ""Mandoverwatch"" Overwatch/Mando mash-ups by Vinzer",1597068522,,StarWars,VinzerFlinn,False,/r/StarWars/comments/i75h9j/first_8_mandoverwatch_overwatchmando_mashups_by/
30,Wanted to post this on r/cringetopia but thought it for here more,1597068453,,StarWars,bool1060,False,/r/StarWars/comments/i75gjj/wanted_to_post_this_on_rcringetopia_but_thought/
31,The Jedi Are Real - Secret #111uminati Alien Invasion,1597067991,,StarWars,supmandude,False,/r/StarWars/comments/i75bok/the_jedi_are_real_secret_111uminati_alien_invasion/
32,Darth Vader #13 Textless Cover (Art by Giuseppe Camuncoli),1597067985,,StarWars,AbsurdVoid,False,/r/StarWars/comments/i75bmv/darth_vader_13_textless_cover_art_by_giuseppe/
33,When did Anakin learn to become a force ghost?,1597067882,"Retaining your living consciousness after death is a force ability that is learned not something that just happens. 

Qui Gon Figured it out

Qui Gon Told Yoda

Yoda told Obi

I can only assume Obi/Yoda ghosts taught Luke

Luke Taught Leia

Leia / Luke taught Ben (no force ghost but he disappears and becomes one with the cosmic force)

I can't recall when Anakin had an opportunity to learn since there wasn't really an opportunity for Obi to teach him in life and it doesn't seem to be an ability the Sith know how to do or else you'd have these ghost wars of dead sith/Jedi popping in on people all the time like harry potter ghosts. 

in ANH Vader appears puzzled by Obi's disappearance when he's killed so you can assume he learned this after ANH sometime. 

Snoke/Palp don't know about it so you can figure that Kylo kept a secret from his master as well as Vader having to have learned it from someone other than Palpatine. 

At the end of ROTJ we see Anakin chilling with everyone else who knows it (other than QGJ)  Howd Vader learn?  Or is he just so force poweful that he figured it out?",StarWars,Backpacks_Got_Jets,False,/r/StarWars/comments/i75aoq/when_did_anakin_learn_to_become_a_force_ghost/
34,He has the best Death Stars. They’re great.,1597067718,,StarWars,whitewreath,False,/r/StarWars/comments/i7593y/he_has_the_best_death_stars_theyre_great/
35,Part of the AT-TW that will be able to completely detach from the AT-TW. I don’t have a name for this titan walker either,1597067505,,StarWars,IndependentTexas,False,/r/StarWars/comments/i75724/part_of_the_attw_that_will_be_able_to_completely/
36,"In-Universe, are humans a minority or a majority of the Galaxy’s population?",1597067469,,StarWars,DragonBat362,False,/r/StarWars/comments/i756os/inuniverse_are_humans_a_minority_or_a_majority_of/
37,What are some Jedi secrets that I can tell my nephew?,1597067360,"We recently learned that the reason why Jedi don't get hit by blasters is because they actually know where the trooper/droid is going to point their weapon, so they know where to block before their enemy has even pulled the trigger!",StarWars,NASA_Lies,False,/r/StarWars/comments/i755oc/what_are_some_jedi_secrets_that_i_can_tell_my/
38,Really close game of HvV made friends with Vader after the match,1597066997,,StarWars,mrblondechannel,False,/r/StarWars/comments/i7528l/really_close_game_of_hvv_made_friends_with_vader/
39,Darth Vader #5 Textless Cover (Art by Giuseppe Camuncoli),1597066727,,StarWars,AbsurdVoid,False,/r/StarWars/comments/i74zkq/darth_vader_5_textless_cover_art_by_giuseppe/
40,Love this Start Wars milk packaging design!,1597066719,,StarWars,nicknicket,False,/r/StarWars/comments/i74zi3/love_this_start_wars_milk_packaging_design/
