,title,created_utc,selftext,subreddit,author,media_only,permalink
0,Star Wars: The Clone Wars - Season 7 Poster,1597497596,[removed],StarWars,iamg3n0t,False,/r/StarWars/comments/ia780e/star_wars_the_clone_wars_season_7_poster/
1,Spotify,1597496787,"I was just listening to some of the soundtracks and remembering the timer at the bottom is a lightsaber, and had an obvious thought while listening to duel of the fates, but why arent the songs based on the dark side of the force red lightsabers (eg. imperial march) and not blue and it would be cool if they changed the lightsabers based on the persons theme or who it was meant for. Meaning yodas theme is his green lightsaber. Just a cool little idea I thought of.",StarWars,AlexH612,False,/r/StarWars/comments/ia70yp/spotify/
2,Things people do for love,1597496685,,StarWars,knights_of_night,False,/r/StarWars/comments/ia7010/things_people_do_for_love/
3,The Clone Wars - Season 7 Poster,1597496684,,StarWars,iamg3n0t,False,/r/StarWars/comments/ia700l/the_clone_wars_season_7_poster/
4,Should I watch Star Wars: The Clone Wars before I watch The Mandalorian Season 2?,1597496669,[removed],StarWars,XxA1_P1L0TxX,False,/r/StarWars/comments/ia6zuc/should_i_watch_star_wars_the_clone_wars_before_i/
5,What kind of lighsaber would yours be?,1597496352,"[removed]

[View Poll](https://www.reddit.com/poll/ia6wt1)",StarWars,sponkleshonk061089,False,/r/StarWars/comments/ia6wt1/what_kind_of_lighsaber_would_yours_be/
6,COVERT OPTS Clone Troopers need to be in Star Wars: The Bad Batch(S1) and i explain why,1597495864,[removed],StarWars,Darktyranno709,False,/r/StarWars/comments/ia6sqv/covert_opts_clone_troopers_need_to_be_in_star/
7,Star Wars: The Clone Wars - Season 7 Poster,1597495748,[removed],StarWars,iamg3n0t,False,/r/StarWars/comments/ia6rr6/star_wars_the_clone_wars_season_7_poster/
8,I'm all the Jedi (awesome version),1597495575,[removed],StarWars,alderwalder,False,/r/StarWars/comments/ia6qe2/im_all_the_jedi_awesome_version/
9,Who's 16 and want to watch Star Wars with me?,1597495440,I'm bored,StarWars,asrulafif,False,/r/StarWars/comments/ia6p9v/whos_16_and_want_to_watch_star_wars_with_me/
10,Why is Palpatine so strong?,1597495299,"The sith seem to take strength from emotions like hatred, fear, revenge and so on. Palpatine doesn't seem to feel any of those very strongly at all.    

He seems calm and collected, nothing seems to indicate that he's emotional at all (especially compared to anakin, for example). Why is his force so strong?",StarWars,cell689,False,/r/StarWars/comments/ia6o28/why_is_palpatine_so_strong/
11,"in 2019, I made this calendar. This calendar is written in Aurebesh. and the marks I wrote on it are also Aurebesh. I made this just for fun.",1597494539,,StarWars,Zeemer101,False,/r/StarWars/comments/ia6hkx/in_2019_i_made_this_calendar_this_calendar_is/
12,"Just got this guy for my birthday, decided to take a few shots of him.",1597494452,,StarWars,capybara14,False,/r/StarWars/comments/ia6gv3/just_got_this_guy_for_my_birthday_decided_to_take/
13,Death Star cake.,1597494444,,StarWars,iangroves,False,/r/StarWars/comments/ia6gsp/death_star_cake/
14,Bet this is true.,1597494391,,StarWars,iangroves,False,/r/StarWars/comments/ia6gdo/bet_this_is_true/
15,"My 1 attempt on drawing Anakin. I'm not sure anymore if it looks like him, but I was trying:/",1597493116,,StarWars,DeanaSW,False,/r/StarWars/comments/ia667h/my_1_attempt_on_drawing_anakin_im_not_sure/
16,Harrison Ford and Carrie Fisher being absolutely adorable together.,1597492240,,StarWars,act1989,False,/r/StarWars/comments/ia5z8v/harrison_ford_and_carrie_fisher_being_absolutely/
17,Latest additions to the collection!,1597491552,,StarWars,Eagle2502,False,/r/StarWars/comments/ia5ua0/latest_additions_to_the_collection/
18,😂,1597491483,,StarWars,Rip-Sketchy,False,/r/StarWars/comments/ia5tsn/_/
19,Hello there,1597489549,,StarWars,yoboi1w34,False,/r/StarWars/comments/ia5gex/hello_there/
20,Found this while taking a walk. Thought you guys might be interested.,1597489151,,StarWars,Arcronixbuilder05,False,/r/StarWars/comments/ia5dgf/found_this_while_taking_a_walk_thought_you_guys/
21,Money does buy happiness,1597488318,,StarWars,Manuah56,False,/r/StarWars/comments/ia589z/money_does_buy_happiness/
22,"I kinda wish we could’ve seen these guys in a film/TV show. Would have been amazing, even if it was non-canon",1597488189,,StarWars,MyPrEsCiOuSsS,False,/r/StarWars/comments/ia57dq/i_kinda_wish_we_couldve_seen_these_guys_in_a/
23,KOTOR 3: Why It Should Happen Now,1597488132,,StarWars,puffin_man,False,/r/StarWars/comments/ia56zy/kotor_3_why_it_should_happen_now/
24,"A lego star wars CHRISTMAS SPECIAL is coming soon, and it has to do with time travel or something....",1597487056,,StarWars,Kinglens311,False,/r/StarWars/comments/ia5019/a_lego_star_wars_christmas_special_is_coming_soon/
25,I made a Star Wars Rebels poster in Clone Wars S7 style. Hope you all like it.,1597486758,,StarWars,StephenHolmes_,False,/r/StarWars/comments/ia4y0w/i_made_a_star_wars_rebels_poster_in_clone_wars_s7/
26,Ewan Mcgregor loses half of Star Wars royalties in divorce.,1597486232,,StarWars,Kingflares,False,/r/StarWars/comments/ia4upe/ewan_mcgregor_loses_half_of_star_wars_royalties/
27,My setup! Wish holo conferences were a thing.,1597486059,,StarWars,AliasWarHammer,False,/r/StarWars/comments/ia4tj6/my_setup_wish_holo_conferences_were_a_thing/
28,The film that started it all was released 12 years ago today.,1597486056,,StarWars,BanthaMilk3,False,/r/StarWars/comments/ia4tij/the_film_that_started_it_all_was_released_12/
29,"A lego star wars CHRISTMAS SPECIAL is coming soon, and it has to do with time travel or something....",1597485668,,StarWars,AceBeastBoii,False,/r/StarWars/comments/ia4qxh/a_lego_star_wars_christmas_special_is_coming_soon/
30,Fallen Order worth the buy?,1597485419,So I'm thinking of buying Fallen Order on the Xbox One whilst there's 50% off. Is it worth the buy?,StarWars,hondoohnaka66,False,/r/StarWars/comments/ia4pbf/fallen_order_worth_the_buy/
31,Darth Sidious Claw Machine (Animation by me),1597484211,,StarWars,ImGlad2BHere,False,/r/StarWars/comments/ia4i97/darth_sidious_claw_machine_animation_by_me/
32,A girl met her hero,1597483421,,StarWars,lu_frc,False,/r/StarWars/comments/ia4dhx/a_girl_met_her_hero/
33,Anisoka is bad because of messed up power dynamics! I can’t believe this is something that needs to be said but apparently it is!,1597483144,"Anakin meets ahsoka as an adult, he is her “master”, she seeks approval from him. If they were to enter a romantic relationship it would have ridiculously lopsided power dynamics. 
Ahsoka would do anything for Anakins approval, we see that In clone wars. Part of that anything is engaging in a romantic relationship with him!
There is a reason teacher student relationships are not ok, and this is the reason. 
I can’t believe this is something I need to explain.",StarWars,superheroverthinking,False,/r/StarWars/comments/ia4bq2/anisoka_is_bad_because_of_messed_up_power/
34,Got bored at work so I made an X-wing.,1597483129,,StarWars,can-solo,False,/r/StarWars/comments/ia4bmz/got_bored_at_work_so_i_made_an_xwing/
35,Why doesn’t palpatine just throw people around with the force in fights?,1597480994,"We see the senate constant spewing force lightning in every encounter-and it gets blocked by a measly light sabre. Why doesn’t he just outright levitate and disarm his opponents with the force (like snoke does to Rey in TLJ).

I know count Dooku was able to choke Obi-wan in revenge of the sith (probably with the senates help though) and then throws him across the room.

It’s so distracting knowing he has telekinesis while his face is melting away from force lightning in rise or Skywalker... it’s actually even funnier “all of the sith” hasn’t thought of this in all honesty.",StarWars,COL_PRIME_TIME,False,/r/StarWars/comments/ia3z08/why_doesnt_palpatine_just_throw_people_around/
36,3 year old convinced Snoke was Ancient One due to action figure costume.,1597480703,,StarWars,thejeremx,False,/r/StarWars/comments/ia3xau/3_year_old_convinced_snoke_was_ancient_one_due_to/
37,"Mark Hamill in a state of shock, molding his hand for The Empire Strikes Back",1597480376,,StarWars,InkintoDark,False,/r/StarWars/comments/ia3vdg/mark_hamill_in_a_state_of_shock_molding_his_hand/
38,This is honestly the most depressing Star Wars comic panel ever drawn.,1597478362,,StarWars,IzzytheMelody,False,/r/StarWars/comments/ia3j8z/this_is_honestly_the_most_depressing_star_wars/
39,"Getting there, can’t wait until it’s done",1597477676,,StarWars,rydehyde,False,/r/StarWars/comments/ia3ezc/getting_there_cant_wait_until_its_done/
40,"If you had to condense the original trio logo movies into one movie but still follow the hero’s journey format, what would the plot be?",1597476929,,StarWars,1pointtwentyone,False,/r/StarWars/comments/ia3ael/if_you_had_to_condense_the_original_trio_logo/
41,I made my own Boba Fett cosplay,1597475649,,StarWars,mask_creations,False,/r/StarWars/comments/ia32pt/i_made_my_own_boba_fett_cosplay/
42,Ive been thinking,1597474519,"If you really think about it. Mace windu and yoda always feared anakin’s training. Fear is the path to the darkside. If they didn’t feed into their fear of Anakin, he would of never become a sith. They feared what Anakin could do so they didn’t make him a master. They feared their visions of him. This is really why Anakin became a sith. Not because he feared but because he was feared by his masters.",StarWars,prumkinporn,False,/r/StarWars/comments/ia2vlu/ive_been_thinking/
43,Can some one list how I should whatch star wars in chronological order only including series and movies.,1597473646,,StarWars,cheesepotato11,False,/r/StarWars/comments/ia2pzn/can_some_one_list_how_i_should_whatch_star_wars/
44,"I think a smile doesn't not mean ""adoption"". I think Luke and Leia just smiled at Rey because they were proud of her.",1597473531,,StarWars,Olya-roo,False,/r/StarWars/comments/ia2p98/i_think_a_smile_doesnt_not_mean_adoption_i_think/
45,I loved the prequels but i do think we needed more of Anakin as a hero to make his fall more tragic,1597472644,"I do think his fall to the dark side is tragic but would have been way more impactful if we see him be more a hero and really be out there helping the galaxy. We didn’t see that enough. Saw some of it in ROTS but sort of washed away because he kills dooku in cold blood 

He’s never really likeable or have qualities that make you want to root for him and really view as a good guy or heroic guy.  In fact I’d say he was pretty grey in a sense that he did more bad than good before his fall .  Just needed more of Anakin being a hero.  Part of that is I feel could have been done if the first movie was him older. But I understand that Lucas wanted him leaving  his mother as a big starting point for him to fall tot he dark side 

Curious how everyone else views it.  Essentially what’s r got in the clone wars is what we should have gotten in prequels but obviously a bid condensed",StarWars,omarcoming9439,False,/r/StarWars/comments/ia2jcm/i_loved_the_prequels_but_i_do_think_we_needed/
46,Hi guys I am made voltron oc characters crossover with Star Wars fanficition story,1597471873,,StarWars,Pinkzeo1ranger,False,/r/StarWars/comments/ia2e4p/hi_guys_i_am_made_voltron_oc_characters_crossover/
47,My favorite character,1597470253,,StarWars,-Sanin-,False,/r/StarWars/comments/ia22zf/my_favorite_character/
48,Who’s scream is that in this scene ? some people say it’s palpatine and others anakin in pain on mustafar,1597470141,,StarWars,jedimasterpina,False,/r/StarWars/comments/ia227n/whos_scream_is_that_in_this_scene_some_people_say/
49,I turned 18 today and decided to treat myself for the first time in a while. Worth it purchase.,1597470092,,StarWars,legocat813,False,/r/StarWars/comments/ia21ti/i_turned_18_today_and_decided_to_treat_myself_for/
50,You WILL have a fantastic Friday evening!,1597470052,,StarWars,TheAmerican_Doctor,False,/r/StarWars/comments/ia21i3/you_will_have_a_fantastic_friday_evening/
51,Will I enjoy The Clone Wars if I didn't like the PT?,1597469989,"So I've seen the PT many, many times, but (to me) they didn't age well. But after watching The Mandalorian I've been hankering for some Star Wars which is new to me, fresh, and great. I'm curious whether the cartoon series 'Clone Wars is good for someone whose Star Wars tastes lean more towards the OT? I see so much discussion of it, and by all accounts its received so well.   


Will I still enjoy it? With so many seasons of it to catch up on, I'm just hoping for some confirmation before I invest!   


Thanks for any help! &lt;3",StarWars,audreyhepburning,False,/r/StarWars/comments/ia2119/will_i_enjoy_the_clone_wars_if_i_didnt_like_the_pt/
52,here my watercolor of the tender mandalorian💕🛸,1597469656,,StarWars,sarahivivas,False,/r/StarWars/comments/ia1yok/here_my_watercolor_of_the_tender_mandalorian/
53,"Am I the only one that actually liked the sequel movies? I wish they were written better, but I loved the concept of them.",1597469177,,StarWars,givemesomespace10,False,/r/StarWars/comments/ia1v7b/am_i_the_only_one_that_actually_liked_the_sequel/
54,Is anyone willing to sell their LEGO 9500 Sith Fury-class Interceptor?,1597468346,Im looking for aLEGO 9500 Sith Fury-class Interceptor set that has Darth Malgus etc i just got the set with satle shan etc.,StarWars,Lox1860,False,/r/StarWars/comments/ia1p9p/is_anyone_willing_to_sell_their_lego_9500_sith/
55,How long did it take for Thrawn to become a grand admiral ?,1597467863,I tried looking it up but I can’t find out when he join the empire and I was hoping someone here would know,StarWars,4garrett81H,False,/r/StarWars/comments/ia1lqb/how_long_did_it_take_for_thrawn_to_become_a_grand/
56,What SW prequel/midquel film would you see if it actually got made (or even a book)?,1597467678,"[removed]

[View Poll](https://www.reddit.com/poll/ia1kcx)",StarWars,Olivebranch99,False,/r/StarWars/comments/ia1kcx/what_sw_prequelmidquel_film_would_you_see_if_it/
57,What is an oscilator in starkiller base?,1597466423,"So my buddy and I were discussing of what is a thermal oscillator in starkiller base. In the movie that oscillator is a machine that converts raw unstable energy hence the power of the sun/heat and turn it to a focused/concentrated energy like a beam. So something I could compare it is an adapter that converts ac to dc or pistons that are in vehicles, but this one is a huge piston. Am I close to it or far from it? I was just curious cause of how super fast the resistance engineer came up with it unless he was part of building the machine in secret lol.",StarWars,Darth_Leumas,False,/r/StarWars/comments/ia1b7g/what_is_an_oscilator_in_starkiller_base/
58,Getting into Star Wars,1597465881,"After I finish all of the Star Wars movies, what should I watch? Clone wars or rebels?",StarWars,SalamanderL24,False,/r/StarWars/comments/ia1772/getting_into_star_wars/
59,Why was Anakin able (allowed?) to become one with the Force after being so damn evil?,1597464268,"There’s all this talk about Anakin being a victim of the Dark Side and ultimately his actions as Vader are absolved in his next life in which he’s one with the force. But while he may have been manipulated by Palpatine and the Dark Side, *he* is the one who made all those choices. 

How can so many in the series and fanbase separate him from Vader? It just seems like a way to pull the blame off Anakin by acting like he’s a different individual, but he’s not. Anakin never stopped being Anakin, not really. And to say that he did is just something Anakin and Obi-Wan tell themselves because they can’t accept the truth: that Anakin spent his whole life fighting his angrier, darker nature only to let it become all he was. Maybe it started out of desperation, but in the end that’s just who he always was underneath.

It’s true, he gave the ultimate sacrifice. There’s no true redemption for him but that’s as close as you can get really. Still, how could he become one with the Force when, despite his internal conflict, he is at his core aligned with Dark Side?

I’d like to note Anakin is my favorite character in the franchise. He’s so tragic. As much as a happy ending for him feels good, I can’t help but feel wrong about him getting one as good as becoming one with the Force after all the atrocities he’s committed. It’s like if Hitler went to heaven because right before he died he admitted he was an evil POS and regrets his political career.",StarWars,Zazizax,False,/r/StarWars/comments/ia0v06/why_was_anakin_able_allowed_to_become_one_with/
60,Luke Skywalker's death alternate ending,1597464128,,StarWars,TakBolt,False,/r/StarWars/comments/ia0twp/luke_skywalkers_death_alternate_ending/
61,"""Now THIS is Podracing"". A friend gave me this for my collection. Before that I wasn't aware it was a rumble pack game.",1597463532,,StarWars,rydamusprime17,False,/r/StarWars/comments/ia0p57/now_this_is_podracing_a_friend_gave_me_this_for/
62,Anyone else nervous about Ahsoka appearing in the mandalorian?,1597461757,"I just have a weird feeling since it’s coming straight from animation. Would Ashley eckstein dub the voice too do you think? I don’t know about anyone else but I’d prefer if they left Thrawn, Ezra, and Sabine out of the Mandalorian and instead focused on the already existing characters in the show. If the sequel show to Rebels happened it could then focus completely on that part",StarWars,roll-tarheels,False,/r/StarWars/comments/ia0aql/anyone_else_nervous_about_ahsoka_appearing_in_the/
63,Baby Chewy next?,1597461733,"&amp;#x200B;

https://preview.redd.it/n3lqcb6843h51.jpg?width=640&amp;format=pjpg&amp;auto=webp&amp;s=3eebb1bff4581a23db7a36655a8a98785c0f64c0",StarWars,J3RK,False,/r/StarWars/comments/ia0ajn/baby_chewy_next/
64,GONK!,1597461480,,StarWars,rydamusprime17,False,/r/StarWars/comments/ia08fi/gonk/
65,"first person to comment on this post gets an award for free! no reason, I just feel like being nice",1597460823,[removed],StarWars,VIPGarrett,False,/r/StarWars/comments/ia0322/first_person_to_comment_on_this_post_gets_an/
66,Had a really cool birthday this year :),1597460650,,StarWars,DarthJedi66,False,/r/StarWars/comments/ia01lp/had_a_really_cool_birthday_this_year/
67,"Got this hot toys 1/6th scale stormtrooper for my birthday, immediately set him up for a photo op.",1597460576,,StarWars,capybara14,False,/r/StarWars/comments/ia00yg/got_this_hot_toys_16th_scale_stormtrooper_for_my/
68,"Did this to my room, lmk what you think",1597460527,,StarWars,jrodspridco,False,/r/StarWars/comments/ia00j5/did_this_to_my_room_lmk_what_you_think/
69,"My dumb stupid idiot fat stupid brother learned battle of the hero’s on piano and wanted me to share, enjoy :)",1597460335,,StarWars,MyParntsChekMyOtrAcc,False,/r/StarWars/comments/i9zyx2/my_dumb_stupid_idiot_fat_stupid_brother_learned/
70,"I drew Cal and BD1, I hope you guys like it!",1597459612,,StarWars,yoboi1w34,False,/r/StarWars/comments/i9zszj/i_drew_cal_and_bd1_i_hope_you_guys_like_it/
71,What is the best droid and why is the gonk droid,1597458101,[removed],StarWars,felucianfunkmeister,False,/r/StarWars/comments/i9zg4t/what_is_the_best_droid_and_why_is_the_gonk_droid/
72,Hello there ;) It says CHRIS,1597458064,,StarWars,ToulouseLeMex,False,/r/StarWars/comments/i9zfts/hello_there_it_says_chris/
73,Duel Irony,1597457711,"Anyone find it funny that Obi-Wan, while killing General Grievous and Anakin , while killing the separatists were both technically serving Palpatine?",StarWars,Wiseguy4252,False,/r/StarWars/comments/i9zcwy/duel_irony/
74,New décor featuring my favorite movie ever.,1597457693,,StarWars,wesskywalker,False,/r/StarWars/comments/i9zcrq/new_décor_featuring_my_favorite_movie_ever/
75,"Here is me collection of Star Wars books, not all of them fit on the shelf",1597457402,[removed],StarWars,VIPGarrett,False,/r/StarWars/comments/i9zabk/here_is_me_collection_of_star_wars_books_not_all/
76,Just put up a poster of my favorite movie ever!,1597457340,,StarWars,wesskywalker,False,/r/StarWars/comments/i9z9st/just_put_up_a_poster_of_my_favorite_movie_ever/
77,New poster of my favorite movie of all time!,1597457255,,StarWars,wesskywalker,False,/r/StarWars/comments/i9z93b/new_poster_of_my_favorite_movie_of_all_time/
78,Blackbuster now that's a name i haven't heard in a long long time,1597457114,,StarWars,CaptainKill93,False,/r/StarWars/comments/i9z7xu/blackbuster_now_thats_a_name_i_havent_heard_in_a/
79,A true Jedi,1597457020,,StarWars,chocolat_ice_cream,False,/r/StarWars/comments/i9z73p/a_true_jedi/
80,"I watched all Star Wars movies for the first time over quarantine, this is my personal ranking of all of the ones I watched.",1597456895,[removed],StarWars,bumbleblast,False,/r/StarWars/comments/i9z62n/i_watched_all_star_wars_movies_for_the_first_time/
81,Fresh find at the store,1597456631,,StarWars,cjmedina38,False,/r/StarWars/comments/i9z3t9/fresh_find_at_the_store/
82,"My Star Wars book collection, not all of them fit on the shelf",1597456622,,StarWars,VIPGarrett,False,/r/StarWars/comments/i9z3qf/my_star_wars_book_collection_not_all_of_them_fit/
83,going to the beach 😃👍,1597456364,,StarWars,OldManJulian,False,/r/StarWars/comments/i9z1i5/going_to_the_beach/
84,[spoilers] A being/group the sith fears,1597456289,"Just out of curiousity cause this is a threat I'd like to see in the future of SW but in the EU/disnEU, was there ever a being or group of beings the sith feared more than the jedi? Maybe a sith who hunts sith or bounty hunters, those are the only things that come to mind. I suppose large creatures like rancors or sand monsters could be fearsome to a sith.",StarWars,tommymikaelson,False,/r/StarWars/comments/i9z0ti/spoilers_a_beinggroup_the_sith_fears/
85,Help This Reddit Rematch Santa,1597456274,"I have been rematched with woman who has two young girls that were supposed to go to Disney this year. Since they can’t go to Disney because of COVID, I was hoping to bring Disney to them. I was hoping to find a Chewbacca and Anna to FaceTime or Skype with these two young girls. I do want to compensate these individuals that would be willing to do this. Please let me know if yourself or someone you know can help me pull this. Thank you all in advance",StarWars,BClements72,False,/r/StarWars/comments/i9z0o9/help_this_reddit_rematch_santa/
86,A painting my girlfriend made she always said that the droids would look so cute gardening.,1597456055,,StarWars,flintstevenson,False,/r/StarWars/comments/i9yysl/a_painting_my_girlfriend_made_she_always_said/
87,Lego Star Wars AT-AT (75288) Timelapse Build!,1597455238,,StarWars,seafoodgodddd,False,/r/StarWars/comments/i9yrjb/lego_star_wars_atat_75288_timelapse_build/
88,How does Maz get the skywalker lightsaber?,1597455037,Is it ever explained in some extra content what happens to the skywalker lightsaber shyer it falls in episode V?,StarWars,Chellzie,False,/r/StarWars/comments/i9ypr8/how_does_maz_get_the_skywalker_lightsaber/
89,I think that the yoda species is the light side equivalent of the sith species. And that there has to be a dark side equivalent to the force priestesses,1597454763,"We all know that the force must be balanced. 

We know that the force wielders are a balanced system. The light represented by the daughter, the dark represented by the son and the middle is the father. We also know that the bendu is in the middle. The force priestesses are very light side aligned. though you could make an argument that they are also in the middle because the summon dark side illusions, but they are just that illusions, and the teach yoda and qui-gon how to become force ghosts which is a life side ability as far as I know. Because the force must be balanced there has to be a dark side equivalent of them. 

And then a level down we have species. The sith species are very much so naturally drawn to the dark side. There would have to be a light side equivalent of the sith. I say it would be the yoda species. They could even be the reason the Jedi are called the Jedi. Though through the millennia the name could haBe Ben altered. Mabey the name of the species is the di-je or something like that. The di-je would be naturally pulled more to the light side. Though this depends a lot on how they are raised.


We know the sith are extinct and that is due at least in part to their tendency to kill each other.  As as a result of the extinction of the sith, The di-je also almost go extinct.  due to their long life span their would be little need to procreate very much. So they go nearly extinct, there are only the known di-je in cannon. at least two others would have to exist, they would be the parents of the child.

You might be asking what about the middle ground, there has to be a middle ground. I think the middle ground would be humans. Not naturally pulled one way or they other, due mostly to a very low percentage of humans would be force sensitive. But they ones that are not naturally pulled to one side or the other. They are groomed by one side but that is not the natural alignment of the species. This explains why the chosen one is a human. The one who brings balance would come from the species that is the middle ground in terms of the force.

I saw a theory a while ago that stated that the child is the light to anakin’s dark. Reasoning behind it is that they were born in the same year And darkness rises and light to meet it. 

 What would be the dark side equivalent of the force priestesses?    What are your thoughts?     How wrong am I?",StarWars,private_jimmy1,False,/r/StarWars/comments/i9ynev/i_think_that_the_yoda_species_is_the_light_side/
